<script setup>
defineProps({
  msg: {
    type: String,
    required: true
  }
})
</script>

<template>
  <div class="greetings">
    <h1 class="green">{{ msg }}</h1>
    <h3>
      Hamkorlar <br> 
      <a target="_blank" href="https://xinux.uz/">Xinux.uz</a> va
      <a target="_blank" href="https://it-park.uz/">It-Park</a>.
    </h3>
  </div>
</template>

<style scoped>
h1 {
  font-weight: 500;
  font-size: 2.6rem;
  top: -10px;
}

h3 {
  font-size: 1.2rem;
}

.greetings h1,
.greetings h3 {
  text-align: center;
}

@media (min-width: 1024px) {
  .greetings h1,
  .greetings h3 {
    text-align: left;
  }
}
</style>





<!-- 
----------------------------------------------------------------------------
CrystalDiskInfo 8.0.0 (C) 2008-2018 hiyohiyo
                                Crystal Dew World : https://crystalmark.info/
----------------------------------------------------------------------------

    OS : Windows 11 Professional [10.0 Build 22000] (x64)
  Date : 2022/04/19 20:04:25

-- Controller Map ----------------------------------------------------------
 - Standard SATA AHCI Controller [ATA]
 - Microsoft Storage Spaces Controller [SCSI]
 + Standard NVM Express Controller [SCSI]
   - XrayDisk 128GB

-- Disk List ---------------------------------------------------------------
 (1) XrayDisk 128GB : 128,0 GB [0/1/0, sq] - nv

----------------------------------------------------------------------------
 (1) XrayDisk 128GB
----------------------------------------------------------------------------
           Model : XrayDisk 128GB
        Firmware : T1103F0L
   Serial Number : AA000000000000000116
       Disk Size : 128,0 GB
     Buffer Size : Неизвестно
    # of Sectors : 
   Rotation Rate : ---- (SSD)
       Interface : NVM Express
   Major Version : NVM Express 1.3
   Minor Version : 
   Transfer Mode : PCIe 3.0 x4 | PCIe 3.0 x4
  Power On Hours : 364 ч
  Power On Count : 307 раз
      Host Reads : 1654 GB
     Host Writes : 1623 GB
     Temperature : 45 C (113 F)
   Health Status : Хорошо (100 %)
        Features : S.M.A.R.T.
       APM Level : ----
       AAM Level : ----
    Drive Letter : C:

-- S.M.A.R.T. --------------------------------------------------------------
ID RawValues(6) Attribute Name
01 000000000000 Critical Warning
02 00000000013E Composite Temperature
03 000000000064 Available Spare
04 00000000000A Available Spare Threshold
05 000000000000 Percentage Used
06 00000033B31F Data Units Read
07 00000032BB4B Data Units Written
08 000001ECF712 Host Read Commands
09 00000321B1EA Host Write Commands
0A 00000000066B Controller Busy Time
0B 000000000133 Power Cycles
0C 00000000016C Power On Hours
0D 000000000050 Unsafe Shutdowns
0E 000000000000 Media and Data Integrity Errors
0F 000000000000 Number of Error Information Log Entries

-- IDENTIFY_DEVICE ---------------------------------------------------------
        0    1    2    3    4    5    6    7    8    9
000: 126F 126F 4141 3030 3030 3030 3030 3030 3030 3030
010: 3130 3631 7258 7961 6944 6B73 3120 3832 4247 2020
020: 2020 2020 2020 2020 2020 2020 2020 2020 2020 2020
030: 2020 2020 3154 3031 4633 4C30 0106 0000 0600 0001
040: 0300 0001 86A0 0001 3880 0001 0200 0000 0000 0000
050: 0000 0000 0000 0000 0000 0000 0000 0000 0000 0000
060: 0000 0000 0000 0000 0000 0000 0000 0000 0000 0000
070: 0000 0000 0000 0000 0000 0000 0000 0000 0000 0000
080: 0000 0000 0000 0000 0000 0000 0000 0000 0000 0000
090: 0000 0000 0000 0000 0000 0000 0000 0000 0000 0000
100: 0000 0000 0000 0000 0000 0000 0000 0000 0000 0000
110: 0000 0000 0000 0000 0000 0000 0000 0000 0000 0000
120: 0000 0000 0000 0000 0000 0000 0000 0000 0007 0704
130: 0312 003F 0000 0164 0166 0064 4000 0000 2000 0000
140: 6000 CF85 001D 0000 0000 0000 0000 0000 0000 0000
150: 0000 0000 0000 0000 0000 0000 0000 0000 0000 0400
160: 0000 0001 0111 0166 0000 0000 0000 0000 0000 0000
170: 0000 0000 0000 0000 0000 0000 0000 0000 0000 0000
180: 0000 0000 0000 0000 0000 0000 0000 0000 0000 0000
190: 0000 0000 0000 0000 0000 0000 0000 0000 0000 0000
200: 0000 0000 0000 0000 0000 0000 0000 0000 0000 0000
210: 0000 0000 0000 0000 0000 0000 0000 0000 0000 0000
220: 0000 0000 0000 0000 0000 0000 0000 0000 0000 0000
230: 0000 0000 0000 0000 0000 0000 0000 0000 0000 0000
240: 0000 0000 0000 0000 0000 0000 0000 0000 0000 0000
250: 0000 0000 0000 0000 0000 0000

-- SMART_NVME --------------------------------------------------------------
     +0 +1 +2 +3 +4 +5 +6 +7 +8 +9 +A +B +C +D +E +F
000: 00 3E 01 64 0A 00 00 00 00 00 00 00 00 00 00 00
010: 00 00 00 00 00 00 00 00 00 00 00 00 00 00 00 00
020: 4D B3 33 00 00 00 00 00 00 00 00 00 00 00 00 00
030: 6C BB 32 00 00 00 00 00 00 00 00 00 00 00 00 00
040: 0B FA EC 01 00 00 00 00 00 00 00 00 00 00 00 00
050: 2E B5 21 03 00 00 00 00 00 00 00 00 00 00 00 00
060: 6B 06 00 00 00 00 00 00 00 00 00 00 00 00 00 00
070: 33 01 00 00 00 00 00 00 00 00 00 00 00 00 00 00
080: 6C 01 00 00 00 00 00 00 00 00 00 00 00 00 00 00
090: 50 00 00 00 00 00 00 00 00 00 00 00 00 00 00 00
0A0: 00 00 00 00 00 00 00 00 00 00 00 00 00 00 00 00
0B0: 00 00 00 00 00 00 00 00 00 00 00 00 00 00 00 00
0C0: 00 00 00 00 00 00 00 00 00 00 00 00 00 00 00 00
0D0: 00 00 00 00 00 00 00 00 00 00 00 00 00 00 00 00
0E0: 00 00 00 00 00 00 00 00 00 00 00 00 00 00 00 00
0F0: 00 00 00 00 00 00 00 00 00 00 00 00 00 00 00 00
100: 00 00 00 00 00 00 00 00 00 00 00 00 00 00 00 00
110: 00 00 00 00 00 00 00 00 00 00 00 00 00 00 00 00
120: 00 00 00 00 00 00 00 00 00 00 00 00 00 00 00 00
130: 00 00 00 00 00 00 00 00 00 00 00 00 00 00 00 00
140: 00 00 00 00 00 00 00 00 00 00 00 00 00 00 00 00
150: 00 00 00 00 00 00 00 00 00 00 00 00 00 00 00 00
160: 00 00 00 00 00 00 00 00 00 00 00 00 00 00 00 00
170: 00 00 00 00 00 00 00 00 00 00 00 00 00 00 00 00
180: 00 00 00 00 00 00 00 00 00 00 00 00 00 00 00 00
190: 00 00 00 00 00 00 00 00 00 00 00 00 00 00 00 00
1A0: 00 00 00 00 00 00 00 00 00 00 00 00 00 00 00 00
1B0: 00 00 00 00 00 00 00 00 00 00 00 00 00 00 00 00
1C0: DB 00 00 00 DB 00 00 00 00 00 2F 00 B8 00 52 00
1D0: 01 00 00 00 00 00 00 00 00 00 00 00 00 00 00 00
1E0: 00 00 00 00 00 00 00 00 00 00 00 00 00 00 00 00
1F0: C6 00 00 00 00 00 00 00 00 00 00 00 00 00 00 00
 -->
